ID,Status,Chapter(s),Disposition,Verification
T04,CLOSED — CORRECTED,Chapter 1,Exact sentence replacement applied,1 tracked paragraph replacement
T05,CLOSED — CORRECTED,Chapter 23,Complete malformed paragraph replacement applied,1 tracked paragraph replacement
T06,CLOSED — CORRECTED,Chapter 1,Both fraction phrases hyphenated,2 tracked paragraph replacements
T07,CLOSED — CORRECTED,Prologue,Narrative time changed to 02:14; identifiers untouched,1 tracked paragraph replacement
T08,CLOSED — CORRECTED,Chapters 20–21,Five narrative uses changed to requester; four literal field uses retained as requestor,All 9 occurrences reviewed
T09,CLOSED — INTENTIONALLY RETAINED,Chapters 6 and 11,All four Sarah motif occurrences retained,4 contextual occurrences reviewed
